review_time,positive_review,negative_review,problems_solved,rating,reviews,sentiment_score,positive_sentiment,negative_sentiment
2022-03-10,The best thing about monster is their user interface. It's easy to be used and accessibleReview collected by and hosted on G2.com.,Less filters. Sometimes It becomes difficult to get the perfect candidate de to less filtersReview collected by and hosted on G2.com.,"Hiring, Recruitment, sourcing, Job Description checkingReview collected by and hosted on G2.com.",4.0,"['best', 'thing', 'monster', 'user', 'interface', 'easy', 'used', 'accessiblereview', 'collected', 'hosted', 'less', 'filters', 'sometimes', 'becomes', 'difficult', 'get', 'perfect', 'candidate', 'de', 'less', 'filtersreview', 'collected', 'hosted']",0.37916666666666665,0.7166666666666667,0.04166666666666668
2021-08-31,"Usually, my last resource if I can't find anything on other job boards and usually they will have individualsReview collected by and hosted on G2.com.","Seems like none of the candidates get back to you, they always have old resumes and not active candidates, I don't prefer the searching settings you can't even edit the boolean from that page when you are sourcing, just not my favorite job boardReview collected by and hosted on G2.com.",Finding candidates with sourcing and qualifying for jobsReview collected by and hosted on G2.com.,4.0,"['usually', 'last', 'resource', 'ca', 'find', 'anything', 'job', 'boards', 'usually', 'individualsreview', 'collected', 'hosted', 'seems', 'like', 'none', 'candidates', 'get', 'back', 'always', 'old', 'resumes', 'active', 'candidates', 'prefer', 'searching', 'settings', 'ca', 'even', 'edit', 'boolean', 'page', 'sourcing', 'favorite', 'job', 'boardreview', 'collected', 'hosted']",0.020833333333333343,-0.125,0.16666666666666669
2021-11-23,A large database of good candidates across multiple skills & domains.Review collected by and hosted on G2.com.,"Not much to say regarding what I dislike. The reality is it is no longer the go-to tool for our recruiters as it used to be due to the emergence of LinkedIn, but still very valuable.Review collected by and hosted on G2.com.",It allows us to find immediately available candidates for our open jobs.Review collected by and hosted on G2.com.,4.0,"['large', 'database', 'good', 'candidates', 'across', 'multiple', 'skills', 'collected', 'hosted', 'much', 'say', 'regarding', 'dislike', 'reality', 'longer', 'tool', 'recruiters', 'used', 'due', 'emergence', 'linkedin', 'still', 'collected', 'hosted']",0.1482142857142857,0.30476190476190473,-0.008333333333333331
2021-09-16,I was able to find a lot of job opportunities that suit me. It also helped in gaining market trends and insights.Review collected by and hosted on G2.com.,The number of notifications can sometimes be disturbing.Review collected by and hosted on G2.com.,Wider job opportunities to find your dream job!Review collected by and hosted on G2.com.,4.0,"['able', 'find', 'lot', 'job', 'opportunities', 'suit', 'also', 'helped', 'gaining', 'market', 'trends', 'collected', 'hosted', 'number', 'notifications', 'sometimes', 'collected', 'hosted']",0.25,0.5,0.0
2021-12-09,Simple and easy to use when searching for viable candidates. I like the filter options they have.Review collected by and hosted on G2.com.,"Not necessarily to the fault of Monster, but candidate response rate is typically low in comparison to other sourcing platforms we use.Review collected by and hosted on G2.com.",It helps us find candidates for open roles with fewer applicants than we would anticipate.Review collected by and hosted on G2.com.,3.5,"['simple', 'easy', 'use', 'searching', 'viable', 'candidates', 'like', 'filter', 'options', 'collected', 'hosted', 'necessarily', 'fault', 'monster', 'candidate', 'response', 'rate', 'typically', 'low', 'comparison', 'sourcing', 'platforms', 'collected', 'hosted']",0.08750000000000001,0.21666666666666667,-0.041666666666666664
2021-12-08,"The quality of resumes is good, and the database is extensive.Review collected by and hosted on G2.com.",The Boolean search string could be more user-friendly.Review collected by and hosted on G2.com.,"Monster was my go-to Job Board for all kinds of roles. The database is vast, and finding good-quality resumes was a simple task.Review collected by and hosted on G2.com.",4.5,"['quality', 'resumes', 'good', 'database', 'collected', 'hosted', 'boolean', 'search', 'string', 'could', 'collected', 'hosted']",0.6,0.7,0.5
2021-12-17,"Monster is really helpful when sourcing , The speed of the monster and its really understable.Review collected by and hosted on G2.com.","Monster shares irrelevant profiles sometimes, and there is no option to put experienceReview collected by and hosted on G2.com.","Till now not yet,Review collected by and hosted on G2.com.",5.0,"['monster', 'really', 'helpful', 'sourcing', 'speed', 'monster', 'really', 'collected', 'hosted', 'monster', 'shares', 'irrelevant', 'profiles', 'sometimes', 'option', 'put', 'experiencereview', 'collected', 'hosted']",-0.15,0.2,-0.5
2021-04-21,i would like the system better if it worked.  It is very frustrating.  There is no available supportReview collected by and hosted on G2.com.,The system does not work.  It takes days to get support.  Multiple phone calls with no adequate responseReview collected by and hosted on G2.com.,system is not working properly.  I cant get help.  I will never use monster againReview collected by and hosted on G2.com.,0.5,"['would', 'like', 'system', 'better', 'worked', 'frustrating', 'available', 'supportreview', 'collected', 'hosted', 'system', 'work', 'takes', 'days', 'get', 'support', 'multiple', 'phone', 'calls', 'adequate', 'responsereview', 'collected', 'hosted']",-0.07833333333333334,-0.07333333333333335,-0.08333333333333333
2021-07-30,It's a world class portal that provide you access to find Job and candidate globally.Review collected by and hosted on G2.com.,"Their support system is worst I have ever seen, they don't give you proper reply when you needed. Another thing is phishing.scammer can cheat you through here. So you need to be careful.Review collected by and hosted on G2.com.",As a jobseeker I have found many offer though it and most of them were geniune. Still using it to find Job individually.Review collected by and hosted on G2.com.,3.5,"['world', 'class', 'portal', 'provide', 'access', 'find', 'job', 'candidate', 'collected', 'hosted', 'support', 'system', 'worst', 'ever', 'seen', 'give', 'proper', 'reply', 'needed', 'another', 'thing', 'cheat', 'need', 'collected', 'hosted']",-0.25,0.0,-0.5
2020-07-29,"Monster is very good tool for job seeker to find a better opportunity and a recruiter to find a matched consultant as per required skills , Monster is being used in most of regions and play a big role in Job market, Monster is one of the best tool in USA, Asia Pacific, India etc. it is helping to both to fill their requirements. monster is very easy to use and Monster team implements to use of it to make it more user friendly for the users.Review collected by and hosted on G2.com.","Although Monster is a good tool, but as an user of monster i don't like one thing about it that if i am sourcing a consultant for any requirement of client, so will get one resume many times with same name and email ID but location is different. so they need to work on it that one resume can be uploaded only one time. and irrelevancy of resumes are very big issue here as per strings. monster is a good tool but some time i felt that if i am working on any niche skill requirement so it is not that much useful sometimes only.Review collected by and hosted on G2.com.","Monster is a very big part of work, i source candidates from monster and it is a very useful tool for me to get a good consultant as per my client's requirement. I posts the Jobs in Monster,  without monster tool my work progress will get down so it is very useful for meReview collected by and hosted on G2.com.",4.5,"['monster', 'good', 'tool', 'job', 'seeker', 'find', 'better', 'opportunity', 'recruiter', 'find', 'matched', 'consultant', 'per', 'required', 'skills', 'monster', 'used', 'regions', 'play', 'big', 'role', 'job', 'market', 'monster', 'one', 'best', 'tool', 'usa', 'asia', 'pacific', 'india', 'etc', 'helping', 'fill', 'requirements', 'monster', 'easy', 'use', 'monster', 'team', 'implements', 'use', 'make', 'user', 'friendly', 'collected', 'hosted', 'although', 'monster', 'good', 'tool', 'user', 'monster', 'like', 'one', 'thing', 'sourcing', 'consultant', 'requirement', 'client', 'get', 'one', 'resume', 'many', 'times', 'name', 'email', 'id', 'location', 'different', 'need', 'work', 'one', 'resume', 'uploaded', 'one', 'time', 'irrelevancy', 'resumes', 'big', 'issue', 'per', 'strings', 'monster', 'good', 'tool', 'time', 'felt', 'working', 'niche', 'skill', 'requirement', 'much', 'useful', 'sometimes', 'collected', 'hosted']",0.40927083333333336,0.5435416666666667,0.27499999999999997
2021-02-24,power search option is useful. profile view in the same window is good.Review collected by and hosted on G2.com.,the filter option is less. plus it shows irrelevant profile for same stringReview collected by and hosted on G2.com.,finding the best profile for the job requirementReview collected by and hosted on G2.com.,3.5,"['power', 'search', 'option', 'useful', 'profile', 'view', 'window', 'collected', 'hosted', 'filter', 'option', 'less', 'plus', 'shows', 'irrelevant', 'profile', 'stringreview', 'collected', 'hosted']",-0.03611111111111111,0.15,-0.2222222222222222
2020-06-03,"The Best thing about Monster is it's advance resume search. You don't need to write long strings, you just need to put the titles and skills which also has an option for ""required"" and ""nice to have"". you can search for the candidates within a certain location and within Certain Miles. you can filter out years of experience and also the resume freshness. You can search for candidates who have updated their resumes one day ago to 1 year ago. It also has some cool features which matches the skills with relevant words. For example, put ""Project Management"" in skills and it'll automatically show you results with the keywords similar to this like ""PMP"", ""PMI"", ""Program Manager"" etc.Review collected by and hosted on G2.com.","There are a couple of things I find preposterous about Monster. First is String length Limitations, in advanced resume search we can only add 5 job titles. Some Position has more than 5 titles for the same position. Other thing I hate about Monster is Duplicate resumes, Fake emails, numbers. you guys really need to work on verifying a genuine resume and a fake one. Some candidates have a couple of profiles on Monster, isn't it redundant to have more than 1 profiles in a Job Portal. There's a word limit so sometimes I'm not able to put all the keywords I want to find relevant candidates.Review collected by and hosted on G2.com.","I search for candidates for all types of Job Requirements (Usually Non-IT) using Monster. Almost everyone who's looking for a job, puts their profile on Monster so it becomes easier to find the right talent.Review collected by and hosted on G2.com.",4.0,"['best', 'thing', 'monster', 'advance', 'resume', 'search', 'need', 'write', 'long', 'strings', 'need', 'put', 'titles', 'skills', 'also', 'option', 'required', 'nice', 'search', 'candidates', 'within', 'certain', 'location', 'within', 'certain', 'miles', 'filter', 'years', 'experience', 'also', 'resume', 'freshness', 'search', 'candidates', 'updated', 'resumes', 'one', 'day', 'ago', 'year', 'ago', 'also', 'cool', 'features', 'matches', 'skills', 'relevant', 'words', 'example', 'put', 'project', 'management', 'skills', 'automatically', 'show', 'results', 'keywords', 'similar', 'like', 'pmp', 'pmi', 'program', 'manager', 'collected', 'hosted', 'couple', 'things', 'find', 'preposterous', 'monster', 'first', 'string', 'length', 'limitations', 'advanced', 'resume', 'search', 'add', 'job', 'titles', 'position', 'titles', 'position', 'thing', 'hate', 'monster', 'duplicate', 'resumes', 'fake', 'emails', 'numbers', 'guys', 'really', 'need', 'work', 'verifying', 'genuine', 'resume', 'fake', 'one', 'candidates', 'couple', 'profiles', 'monster', 'redundant', 'profiles', 'job', 'portal', 'word', 'limit', 'sometimes', 'able', 'put', 'keywords', 'want', 'find', 'relevant', 'collected', 'hosted']",0.17970238095238092,0.3410714285714285,0.018333333333333326
2020-07-16,"Monster has huge database of candidates, which is the best feature of it. I am able to find candidates for most of the requirements I have. I used daily in my recruiting needs. The various filters and its application is superb in real, it works very well. You will find candidates for every position you have no matter its a role of a Customer Service or an IT professional or even a Manager or Executive Level. I even have access to other job boards but I this one is best among all. I would definitely want to keep using it for my recruiting needs ever and ever. The other features that I find really amazing is the ease to store resumes, email them directly through Job board, forward it to any email address, posting jobs works great. I have posted several jobs through this job board and trust me its really easy to do so.Review collected by and hosted on G2.com.","The only thing I dislike is the new website update by them, it is little time consuming compare to the older one.Review collected by and hosted on G2.com.","Monster really helps in lot many ways, reaching out to candidates, helping me out to source for different needs we have for our clients and forming a database as per the set of requirements. It also solves of getting best candidates at one single place, you don't need to go through every single job portal if you have this one. You will find candidates easily for most of your needs.Review collected by and hosted on G2.com.",5.0,"['monster', 'huge', 'database', 'candidates', 'best', 'feature', 'able', 'find', 'candidates', 'requirements', 'used', 'daily', 'recruiting', 'needs', 'various', 'filters', 'application', 'superb', 'real', 'works', 'well', 'find', 'candidates', 'every', 'position', 'matter', 'role', 'customer', 'service', 'professional', 'even', 'manager', 'executive', 'level', 'even', 'access', 'job', 'boards', 'one', 'best', 'among', 'would', 'definitely', 'want', 'keep', 'using', 'recruiting', 'needs', 'ever', 'ever', 'features', 'find', 'really', 'amazing', 'ease', 'store', 'resumes', 'email', 'directly', 'job', 'board', 'forward', 'email', 'address', 'posting', 'jobs', 'works', 'great', 'posted', 'several', 'jobs', 'job', 'board', 'trust', 'really', 'easy', 'collected', 'hosted', 'thing', 'dislike', 'new', 'website', 'update', 'little', 'time', 'consuming', 'compare', 'older', 'collected', 'hosted']",0.18768690191387558,0.3464912280701754,0.028882575757575753
2020-06-05,the best part is we can get job from all over the world very easy to use and also can post for hiringReview collected by and hosted on G2.com.,no such dislike found in this portal i have used its mobile app it is very easy to useReview collected by and hosted on G2.com.,it solved me to get the job my first job i got from  this website and the benefits are we can maintain various resume version and also search near by jobsReview collected by and hosted on G2.com.,5.0,"['best', 'part', 'get', 'job', 'world', 'easy', 'use', 'also', 'post', 'hiringreview', 'collected', 'hosted', 'dislike', 'found', 'portal', 'used', 'mobile', 'app', 'easy', 'usereview', 'collected', 'hosted']",0.5316666666666667,0.7816666666666667,0.2816666666666667
2019-12-06,I like the easy to use layout and the amazing database that Monster has. They have been in the market for so long because of the way they have maintained the database quality. I like that I can search for any candidate pertaining to any requirement and I get the correct candidate.Review collected by and hosted on G2.com.,I wish there was an easier way to filter out certain (non-experienced) candidates. There are some candidates who are not true and have fake experience. There should be a filter for that.,I am someone who recruits and use it very actively. I use Monster to fill the vacancies that I have to work on . The benefits I have realized is that the database is one of the best that have seen till now. I also get other options within the portal to post the jobs and contact more and more qualified candidates.Review collected by and hosted on G2.com.,5.0,"['like', 'easy', 'use', 'layout', 'amazing', 'database', 'monster', 'market', 'long', 'way', 'maintained', 'database', 'quality', 'like', 'search', 'candidate', 'pertaining', 'requirement', 'get', 'correct', 'collected', 'hosted', 'wish', 'easier', 'way', 'filter', 'certain', 'candidates', 'candidates', 'true', 'fake', 'experience', 'filter']",0.0871031746031746,0.3277777777777778,-0.15357142857142858
2019-10-29,It is designed in very user friendly manner.,The best part of the monster is asterisk function that we use to exaggerate our search.,"Being a technical recruiter,It plays a vital role in my recruitment search,Monster is my first preference for any technical positions that I get. I have closed many niche technical or non technical requirement with the help of Monster.It helps me finding the resume of top candidates available in market.Review collected by and hosted on G2.com.",4.5,"['designed', 'user', 'friendly', 'manner', 'best', 'part', 'monster', 'asterisk', 'function', 'use', 'exaggerate', 'search']",0.64375,0.2875,1.0
2019-09-17,"It is the best application in the market for the job seekers. It provides the  best jobs for the job seekers. in this application the applicants  have to fill their details regarding the Educational qualifications , technical skills, location.Review collected by and hosted on G2.com.",by using this application i have not find any problems in this application.Review collected by and hosted on G2.com.,"Monster Application has helped many of the job seekers in getting the jobs. it is one of the best job portal available. In this application we can search the job based upon the preferred location, technical skills, salary,company etc. This application can be used in both computers and as well as cell phones.we can upload our resumes in the Monster job portal and recruiters search for the candidates required for their company. they view our profile and contact us and schedule the interview.the best part about this application its keep on updating and adds new features to its platform. it is very easy and simple to use because of its simple interface.the best part about the monster application is its boolean search. this portal has the regular day to day updates regarding the job openings.Review collected by and hosted on G2.com.",5.0,"['best', 'application', 'market', 'job', 'seekers', 'provides', 'best', 'jobs', 'job', 'seekers', 'application', 'applicants', 'fill', 'details', 'regarding', 'educational', 'qualifications', 'technical', 'skills', 'collected', 'hosted', 'using', 'application', 'find', 'problems', 'collected', 'hosted']",0.28125,0.5625,0.0
2019-09-08,Monster helps me navigate to find new resumes easily through their navigation tools. Each tab is easily accessible and allows me to upload my information and resume quickly and efficiently. I never feel overwhelmed by the website or where to go. The power search has allowed me to create incredibly specific boolean searches for candidates that narrow down resumes very quickly.Review collected by and hosted on G2.com.,"Monster has different types of searches within it, and sometimes it can become confusing whether or not to use the main page search or the classic / power search when looking for postings and also looking for resumes. I wish these search tools were easier to navigate through like the tabs are for the initial splash page.Review collected by and hosted on G2.com.","Monster has benefitted me greatly when finding great candidates in Boolean searches. It allows me to see what resumes are out there and they constantly are updated as recent as the same day. Monster can be a bit confusing when searching, but overall the navigation is self explanatory.Review collected by and hosted on G2.com.",5.0,"['monster', 'helps', 'navigate', 'find', 'new', 'resumes', 'easily', 'navigation', 'tools', 'tab', 'easily', 'accessible', 'allows', 'upload', 'information', 'resume', 'quickly', 'efficiently', 'never', 'feel', 'overwhelmed', 'website', 'go', 'power', 'search', 'allowed', 'create', 'incredibly', 'specific', 'boolean', 'searches', 'candidates', 'narrow', 'resumes', 'collected', 'hosted', 'monster', 'different', 'types', 'searches', 'within', 'sometimes', 'become', 'confusing', 'whether', 'use', 'main', 'page', 'search', 'classic', 'power', 'search', 'looking', 'postings', 'also', 'looking', 'resumes', 'wish', 'search', 'tools', 'easier', 'navigate', 'like', 'tabs', 'initial', 'splash', 'collected', 'hosted']",0.07348800505050505,0.14030934343434345,0.006666666666666665
2019-03-06,"Monster Boolean search is Incredible, the resumes which we are not able to find on any other Job boards, with the help of Monster I am able to submit good and qualified candidates. Now the advance feature of Power resume search has came so that I am able to find US citizen and Green Card also. I love Monster because I can apply as many filters I can so that I can get quality profiles. There are tons of resumes for each and every skills, such as Java, QA, .Net, UI Developer and many other skills etc.Review collected by and hosted on G2.com.","Sometimes one candidate with same skill has applied through Monster number of times so that in 1 or 2 pages are reflecting with that particular candidate, so that is a little embarrassing.Review collected by and hosted on G2.com.","I amble to route & forward the resume to my Inbox so that I can review it later as well. My database is very strong with the help of Monster. I have done many Contractual and full time placements with the help of Monster. I was able to do Job postings through Monster.  We can search a Company profile with the help of Monster, for e.g ex employee of Accenture, TCS, Deloitte, etc.Review collected by and hosted on G2.com.",4.0,"['monster', 'boolean', 'search', 'incredible', 'resumes', 'able', 'find', 'job', 'boards', 'help', 'monster', 'able', 'submit', 'good', 'qualified', 'candidates', 'advance', 'feature', 'power', 'resume', 'search', 'came', 'able', 'find', 'us', 'citizen', 'green', 'card', 'also', 'love', 'monster', 'apply', 'many', 'filters', 'get', 'quality', 'profiles', 'tons', 'resumes', 'every', 'skills', 'java', 'qa', 'ui', 'developer', 'many', 'skills', 'collected', 'hosted', 'sometimes', 'one', 'candidate', 'skill', 'applied', 'monster', 'number', 'times', 'pages', 'reflecting', 'particular', 'candidate', 'little', 'collected', 'hosted']",0.1381944444444444,0.28333333333333327,-0.0069444444444444475
2019-09-16,better and updated results when compared to other job boards. easy Boolean searches. multiple filters to apply to get the best results.Review collected by and hosted on G2.com.,there is not anything in particular that i dislike about Monster but if they can provide the work authorization on the candidate display list. that would be greatReview collected by and hosted on G2.com.,i am solving recruitment related problems like hiring. benefits that i have realized with monster is that we can get fresh resources faster than  any other job boards.Review collected by and hosted on G2.com.,5.0,"['better', 'updated', 'results', 'compared', 'job', 'boards', 'easy', 'boolean', 'searches', 'multiple', 'filters', 'apply', 'get', 'best', 'collected', 'hosted', 'anything', 'particular', 'dislike', 'monster', 'provide', 'work', 'authorization', 'candidate', 'display', 'list', 'would', 'greatreview', 'collected', 'hosted']",0.26416666666666666,0.3616666666666667,0.16666666666666666
2019-05-02,"one of the most efficient tool to search good candidates for recruitment and staffing ,monster provides a lot a good candidates in a more appropriate way .it helps to connect to the good consultant by providing a proper job search and venquishes the need of other portalsReview collected by and hosted on G2.com.",In monster there comes some multiple profiles which makes it difficult to seach new genuine candidates .Review collected by and hosted on G2.com.,with monster i have serached new candidates for recruitment and staffing.it help to search fine consultant that are appropriate for the need.Review collected by and hosted on G2.com.,5.0,"['one', 'efficient', 'tool', 'search', 'good', 'candidates', 'recruitment', 'staffing', 'monster', 'provides', 'lot', 'good', 'candidates', 'appropriate', 'way', 'helps', 'connect', 'good', 'consultant', 'providing', 'proper', 'job', 'search', 'venquishes', 'need', 'portalsreview', 'collected', 'hosted', 'monster', 'comes', 'multiple', 'profiles', 'makes', 'difficult', 'seach', 'new', 'genuine', 'candidates', 'collected', 'hosted']",0.22173295454545452,0.43437499999999996,0.009090909090909094
