review_time,positive_review,negative_review,problems_solved,rating,reviews,sentiment_score,positive_sentiment,negative_sentiment
2018-12-27,"Monster is amazing, you can search resumes by different criteria (position, Cities). Tons of resumes you can review. I love that we are able to leave notes on each resume you review so your co workers or yourself can return and see what you had to say. You are also able to email the resumes to yourself so thats pretty cool! Last but not least you can search recent resumes uploaded without coming across one that was submitted months ago.Review collected by and hosted on G2.com.","It can get a little tricky when searching resumes by position as they have tons of them on their drop down menu so you have to be very specific. Other than that, Monster is a great source that we use here at our office.Review collected by and hosted on G2.com.",We have found great candidates on Monster that had not applied with our company.Review collected by and hosted on G2.com.,5.0,"['monster', 'amazing', 'search', 'resumes', 'different', 'criteria', 'position', 'cities', 'tons', 'resumes', 'review', 'love', 'able', 'leave', 'notes', 'resume', 'review', 'co', 'workers', 'return', 'see', 'say', 'also', 'able', 'email', 'resumes', 'pretty', 'cool', 'last', 'least', 'search', 'recent', 'resumes', 'uploaded', 'without', 'coming', 'across', 'one', 'submitted', 'months', 'collected', 'hosted', 'get', 'little', 'tricky', 'searching', 'resumes', 'position', 'tons', 'drop', 'menu', 'specific', 'monster', 'great', 'source', 'use', 'collected', 'hosted']",0.18006944444444445,0.29375,0.0663888888888889
2018-11-12,"Great tool for sourcing candidates for jobs altogether industries. Its additionally nice for reviewing resumes, finding contact info for clients, and posting jobs. I like that Monster provides you the direct contact info for candidates from their monster profile, and not simply from their resume. I additionally like that it provides the user the power to trace that resumes have already been viewed.Review collected by and hosted on G2.com.",I don't notice that there are tons of latest grad technology resumes on the positioning similar to alternative sites. I work in a special industry currently and realize that there are less relevant job seekers for the roles that Im looking for comparing to mainstream technology resumes are mainly in for contract rolesReview collected by and hosted on G2.com.,"I feel that the search feature on Monster is incredibly well organized. I even have noticed that the advanced search options extremely facilitate me to slender down candidates thus I can really reach my target candidates supported much any measures -- education expertise, years of experience, and even current locationReview collected by and hosted on G2.com.",4.0,"['great', 'tool', 'sourcing', 'candidates', 'jobs', 'altogether', 'industries', 'additionally', 'nice', 'reviewing', 'resumes', 'finding', 'contact', 'info', 'clients', 'posting', 'jobs', 'like', 'monster', 'provides', 'direct', 'contact', 'info', 'candidates', 'monster', 'profile', 'simply', 'resume', 'additionally', 'like', 'provides', 'user', 'power', 'trace', 'resumes', 'already', 'collected', 'hosted', 'notice', 'tons', 'latest', 'grad', 'technology', 'resumes', 'positioning', 'similar', 'alternative', 'sites', 'work', 'special', 'industry', 'currently', 'realize', 'less', 'relevant', 'job', 'seekers', 'roles', 'looking', 'comparing', 'mainstream', 'technology', 'resumes', 'mainly', 'contract', 'rolesreview', 'collected', 'hosted']",0.27729591836734696,0.375,0.1795918367346939
2019-03-05,Monster is one of the best job board i have ever used.I like the best two ways to search a resume one is classic search and other is power search. i always use the power search because inserting job title and location we cab easily get good and local profile as per need.Monster really helps us to find the specific candidates what exactly skills we are looking for by using Boolean search.Review collected by and hosted on G2.com.,"Monster should add every Visa option which are looking for. Only this is the point or drawback i can say about monster, rest all is good.Review collected by and hosted on G2.com.",Monster really solves business problems because it helps us to find very niche skills candidates  which is sometimes not available on other job boards.Review collected by and hosted on G2.com.,4.0,"['monster', 'one', 'best', 'job', 'board', 'ever', 'like', 'best', 'two', 'ways', 'search', 'resume', 'one', 'classic', 'search', 'power', 'search', 'always', 'use', 'power', 'search', 'inserting', 'job', 'title', 'location', 'cab', 'easily', 'get', 'good', 'local', 'profile', 'per', 'really', 'helps', 'us', 'find', 'specific', 'candidates', 'exactly', 'skills', 'looking', 'using', 'boolean', 'collected', 'hosted', 'monster', 'add', 'every', 'visa', 'option', 'looking', 'point', 'drawback', 'say', 'monster', 'rest', 'collected', 'hosted']",0.18125,0.3625,0.0
2019-07-31,"I love this job board for Healthcare related jobs. Majority of the candidates that I'm able to source are fit candidates. You can customize your search if you need bilingual candidates, customize the years of experience, previous companies etc. The results are relevant or A candidates. You can also get lot of updated resumes.Review collected by and hosted on G2.com.",I like everything about this job board. Specially the job posting.Review collected by and hosted on G2.com.,It makes sourcing of candidates easier than ever. You can post jobs as wellReview collected by and hosted on G2.com.,4.5,"['love', 'job', 'board', 'healthcare', 'related', 'jobs', 'majority', 'candidates', 'able', 'source', 'fit', 'candidates', 'customize', 'search', 'need', 'bilingual', 'candidates', 'customize', 'years', 'experience', 'previous', 'companies', 'etc', 'results', 'relevant', 'candidates', 'also', 'get', 'lot', 'updated', 'collected', 'hosted', 'like', 'everything', 'job', 'board', 'specially', 'job', 'collected', 'hosted']",0.3146825396825397,0.2722222222222222,0.35714285714285715
2019-05-01,Power and Classic Search are good to work on different situationsReview collected by and hosted on G2.com.,no visa types exclusions to filter and search for particular typeReview collected by and hosted on G2.com.,recruitment process with high diversification in fields of workReview collected by and hosted on G2.com.,4.5,"['power', 'classic', 'search', 'good', 'work', 'different', 'situationsreview', 'collected', 'hosted', 'visa', 'types', 'exclusions', 'filter', 'search', 'particular', 'typereview', 'collected', 'hosted']",0.22777777777777775,0.28888888888888886,0.16666666666666666
2019-02-28,Monster is the best Job board when it comes to the recruiting it provides a diverse pool of candidates in which we can search a variety of sameReview collected by and hosted on G2.com.,Same Resume is shown multiple times so it creates a nuisance hence the filtering algorithm should be improvedReview collected by and hosted on G2.com.,Monster is a best Job Board for entry level recruiters so it helps the users to understand Boolean search betterReview collected by and hosted on G2.com.,4.5,"['monster', 'best', 'job', 'board', 'comes', 'recruiting', 'provides', 'diverse', 'pool', 'candidates', 'search', 'variety', 'samereview', 'collected', 'hosted', 'resume', 'shown', 'multiple', 'times', 'creates', 'nuisance', 'hence', 'filtering', 'algorithm', 'improvedreview', 'collected', 'hosted']",0.5,1.0,0.0
2019-05-16,every new resume in market we can find first on monster and very helpful to find out resources for each and every technology.Review collected by and hosted on G2.com.,sometimes we get dual resume for so it is time consuming sometime to find out genuine resources.Review collected by and hosted on G2.com.,it is very excellent portal that give organization business to provide then genuine candidate that can clear the interview and can close every position.Review collected by and hosted on G2.com.,5.0,"['every', 'new', 'resume', 'market', 'find', 'first', 'monster', 'helpful', 'find', 'resources', 'every', 'collected', 'hosted', 'sometimes', 'get', 'dual', 'resume', 'time', 'consuming', 'sometime', 'find', 'genuine', 'collected', 'hosted']",0.29772727272727273,0.19545454545454546,0.4
2019-04-03,"I use Monster as a last resort during my sourcing.  I prefer using LinkedIn and CareerBuilder for all of my US sourcing, the candidate pool in Monster is weaker and the search is unwieldy.  You can't even open resumes in new tabs, forcing you to stay on one page. The biggest bonus is that it has a job post board for the UK (although that costs more)Review collected by and hosted on G2.com.",That I can post roles to the UK (which several services do not have)Review collected by and hosted on G2.com.,"It has a pool of candidates, and sometimes people will click on the job posts.  There have not been any noticeable benefits over any other services.Review collected by and hosted on G2.com.",1.0,"['use', 'monster', 'last', 'resort', 'sourcing', 'prefer', 'using', 'linkedin', 'careerbuilder', 'us', 'sourcing', 'candidate', 'pool', 'monster', 'weaker', 'search', 'unwieldy', 'ca', 'even', 'open', 'resumes', 'new', 'tabs', 'forcing', 'stay', 'one', 'page', 'biggest', 'bonus', 'job', 'post', 'board', 'uk', 'although', 'costs', 'review', 'collected', 'hosted', 'post', 'roles', 'uk', 'several', 'services', 'review', 'collected', 'hosted']",0.022727272727272724,0.04545454545454545,0.0
2019-03-06,One of the best feature it has added is of power resume in which we can directly search candidates by putting normal strings and classic resume search is also useful as we can search candidates by using Boolean strings.Review collected by and hosted on G2.com.,"The user interface is not good as compared to another job boards, it should be more attractive.Review collected by and hosted on G2.com.",Being a technical recruiter it helps to get the right candidate for the right job.Review collected by and hosted on G2.com.,3.5,"['one', 'best', 'feature', 'added', 'power', 'resume', 'directly', 'search', 'candidates', 'putting', 'normal', 'strings', 'classic', 'resume', 'search', 'also', 'useful', 'search', 'candidates', 'using', 'boolean', 'collected', 'hosted', 'user', 'interface', 'good', 'compared', 'another', 'job', 'boards', 'collected', 'hosted']",0.2091666666666667,0.3433333333333334,0.07500000000000001
2019-03-06,"one of the best thing of monster is the best and perfect candidate can be searched in one Boolean search, As it as power search as well now which help us to search for Citizen & GCReview collected by and hosted on G2.com.","As per now I could not find any dislike such thing, it always great to use monster portalReview collected by and hosted on G2.com.","fast growing network for finding suitable candidate which make us profitability in the market, which automatically evaluate profit to the businessReview collected by and hosted on G2.com.",5.0,"['one', 'best', 'thing', 'monster', 'best', 'perfect', 'candidate', 'searched', 'one', 'boolean', 'search', 'power', 'search', 'well', 'help', 'us', 'search', 'citizen', 'gcreview', 'collected', 'hosted', 'per', 'could', 'find', 'dislike', 'thing', 'always', 'great', 'use', 'monster', 'portalreview', 'collected', 'hosted']",0.7,1.0,0.4
2018-07-24,"While I was preparing to transition to a new role, I utilized this service to reevaluate my occupational prospects.Review collected by and hosted on G2.com.","I like the displaying of salary, the proximity, and mostly information of the current opportunities provided.Review collected by and hosted on G2.com.",Ensure that your qualifications match the expectations of the job you're applying for.Review collected by and hosted on G2.com.,5.0,"['preparing', 'transition', 'new', 'role', 'utilized', 'service', 'reevaluate', 'occupational', 'collected', 'hosted', 'like', 'displaying', 'salary', 'proximity', 'mostly', 'information', 'current', 'opportunities', 'collected', 'hosted']",0.19318181818181818,0.13636363636363635,0.25
2018-05-02,Use monster daily for posting job and sourcing through the resume databaseReview collected by and hosted on G2.com.,I like the search options in the database just wish I got good new resumes every once in a whileReview collected by and hosted on G2.com.,Check out all your database options and look at what type of jobs youre trying to get candidates fromReview collected by and hosted on G2.com.,3.0,"['use', 'monster', 'daily', 'posting', 'job', 'sourcing', 'resume', 'databasereview', 'collected', 'hosted', 'like', 'search', 'options', 'database', 'wish', 'got', 'good', 'new', 'resumes', 'every', 'whilereview', 'collected', 'hosted']",0.20909090909090908,0.0,0.41818181818181815
2018-07-23,Very easy to use and helps us find new employees.Review collected by and hosted on G2.com.,The super easy to use interface that can be used by anybody.Review collected by and hosted on G2.com.,Sometimes freezes when loading a webpage.Review collected by and hosted on G2.com.,5.0,"['easy', 'use', 'helps', 'us', 'find', 'new', 'collected', 'hosted', 'super', 'easy', 'use', 'interface', 'used', 'collected', 'hosted']",0.3665909090909091,0.34984848484848485,0.3833333333333333
2017-06-19,"This product allows you to post jobs and search for candidates that have posted their profiles to the site.  It also will allow you to reach out to those candidates within the website and manage candidates from there.  It also have an API key for some ATS's that make it easier to import candidates.  Overall, this product helps to get candidates into the pipeline.Review collected by and hosted on G2.com.","I like that it allows me to reach a larger amount of candidates than posting just to my careers page.  It also allows me to search through their candidate base, and has filters that are easy to use to help narrow your search.   They also will rate the candidates you source on a 1-10 scale as to how closely they match the job description.Review collected by and hosted on G2.com.","Monster does provide a good service, but you have to expect a certain type of candidate to apply going in.Review collected by and hosted on G2.com.",2.5,"['product', 'allows', 'post', 'jobs', 'search', 'candidates', 'posted', 'profiles', 'site', 'also', 'allow', 'reach', 'candidates', 'within', 'website', 'manage', 'candidates', 'also', 'api', 'key', 'ats', 'make', 'easier', 'import', 'candidates', 'overall', 'product', 'helps', 'get', 'candidates', 'collected', 'hosted', 'like', 'allows', 'reach', 'larger', 'amount', 'candidates', 'posting', 'careers', 'page', 'also', 'allows', 'search', 'candidate', 'base', 'filters', 'easy', 'use', 'help', 'narrow', 'search', 'also', 'rate', 'candidates', 'source', 'scale', 'closely', 'match', 'job', 'collected', 'hosted']",-0.07083333333333333,0.0,-0.14166666666666666
2017-06-16,Monster is a job board that you can either post your role on to get applicants or source and look at applicants for a role you have open.Review collected by and hosted on G2.com.,When I recruited for a more skilled labor set I used monster a lot and actually found a good amount of candidates through the search. I felt like the system was was easy to sort through and find candidates that were relevant. I like that it's a job board regardless I can post on and hope to be connected with the right candidate and get my job more exposure.Review collected by and hosted on G2.com.,I think it really depends on what talent pool you are looking to connect with. I find that a more skilled labor force tend to put their resumes on Monster.Review collected by and hosted on G2.com.,3.0,"['monster', 'job', 'board', 'either', 'post', 'role', 'get', 'applicants', 'source', 'look', 'applicants', 'role', 'collected', 'hosted', 'recruited', 'skilled', 'labor', 'set', 'used', 'monster', 'lot', 'actually', 'found', 'good', 'amount', 'candidates', 'search', 'felt', 'like', 'system', 'easy', 'sort', 'find', 'candidates', 'relevant', 'like', 'job', 'board', 'regardless', 'post', 'hope', 'connected', 'right', 'candidate', 'get', 'job', 'collected', 'hosted']",0.20744047619047618,0.0,0.41488095238095235
2017-12-06,Monster is very easy and useful for recruiting. You are able to narrow down and find exactly the types of candidates you are looking for.Review collected by and hosted on G2.com.,I think the best part is the search section.Review collected by and hosted on G2.com.,No dislikes but it would be nice to have unlimited clicks.Review collected by and hosted on G2.com.,5.0,"['monster', 'easy', 'useful', 'recruiting', 'able', 'narrow', 'find', 'exactly', 'types', 'candidates', 'looking', 'collected', 'hosted', 'think', 'best', 'part', 'search', 'collected', 'hosted']",0.6048148148148148,0.2096296296296296,1.0
2017-12-06,Monster is used to help find applicant for job postings.Review collected by and hosted on G2.com.,The quality of the candiates is much higher than other sources that I have used in the past.Review collected by and hosted on G2.com.,Definitely use this over other sources.Review collected by and hosted on G2.com.,5.0,"['monster', 'used', 'help', 'find', 'applicant', 'job', 'collected', 'hosted', 'quality', 'candiates', 'much', 'higher', 'sources', 'used', 'collected', 'hosted']",0.03125,0.0,0.0625
2017-10-13,I have used Monster.com as a job-seeker and as a recruiter. I prefer the tool as a recruiter.Review collected by and hosted on G2.com.,"I like the visibility of the product as a recruiter, however my dislikes are related to using this site as a job-seeker.Review collected by and hosted on G2.com.","The spam response and not-truly-qualified-job postings can become annoying and troublesome as a job seeker. After posting my resume while passively job-seeking, I removed it following three days of random recruiter and spam calls. The ads were ridiculously troublesome for me to overcome.Review collected by and hosted on G2.com.",2.0,"['used', 'recruiter', 'prefer', 'tool', 'collected', 'hosted', 'like', 'visibility', 'product', 'recruiter', 'however', 'dislikes', 'related', 'using', 'site', 'collected', 'hosted']",0.0,0.0,0.0
2017-12-06,I use Monster to source candidates for my open IT positions.Review collected by and hosted on G2.com.,I like the ability to be as inclusive on the details as I possibly can.Review collected by and hosted on G2.com.,I highly recommend Monster to those who seek niche skills when recruiting.Review collected by and hosted on G2.com.,4.5,"['use', 'monster', 'source', 'candidates', 'open', 'collected', 'hosted', 'like', 'ability', 'inclusive', 'details', 'possibly', 'collected', 'hosted']",0.0,0.0,0.0
2017-10-27,Great site for searching for candidates and jobs.Review collected by and hosted on G2.com.,Very user friendly and the search screen gives basic information.Review collected by and hosted on G2.com.,I cannot think of anything I dislike about Monster.Review collected by and hosted on G2.com.,5.0,"['great', 'site', 'searching', 'candidates', 'collected', 'hosted', 'user', 'friendly', 'search', 'screen', 'gives', 'basic', 'collected', 'hosted']",0.49583333333333335,0.8,0.19166666666666665
2017-09-19,"Great job board, with great search and posting capabilities.Review collected by and hosted on G2.com.",This tool is very easy to use.  From posting to candidate searching. Training is always available.Review collected by and hosted on G2.com.,i wish response rate to jobs was better.  Sometimes the rate is low or the candidate match is low.Review collected by and hosted on G2.com.,2.5,"['great', 'job', 'board', 'great', 'search', 'posting', 'collected', 'hosted', 'tool', 'easy', 'use', 'posting', 'candidate', 'searching', 'training', 'always', 'collected', 'hosted']",0.6816666666666666,0.8,0.5633333333333334
2017-06-22,"I use monster everyday for sifting through resumes, searching for candidates, and finding qualified candidates to fill internal positions for my company as well as for my clients.Review collected by and hosted on G2.com.","I like the interface of monster, it is easy to navigate. I also like that I am able to search back candidates who have updated their resume 1 day back, 2 days back, 3 days, etc.. I do not have to go from 1 day to 1 week. I also like the ability to save searches.Review collected by and hosted on G2.com.","I wish that I could note candidates who I have already reviewed and passed on so I don't spend time reviewing candidates day after day. I also wish i had the ability to click on one resume, and then search through and click next from there, rather than having to click back to search results and clicking resumes.Review collected by and hosted on G2.com.",3.5,"['use', 'monster', 'everyday', 'sifting', 'resumes', 'searching', 'candidates', 'finding', 'qualified', 'candidates', 'fill', 'internal', 'positions', 'company', 'well', 'collected', 'hosted', 'like', 'interface', 'monster', 'easy', 'navigate', 'also', 'like', 'able', 'search', 'back', 'candidates', 'updated', 'resume', 'day', 'back', 'days', 'back', 'days', 'etc', 'go', 'day', 'week', 'also', 'like', 'ability', 'save', 'collected', 'hosted']",0.043333333333333335,-0.1,0.18666666666666668
2017-12-06,Monster helps me find qualified candidates for a diverse set of jobs I am hiring for.Review collected by and hosted on G2.com.,How many requirements I can add to really help me narrow down my searchReview collected by and hosted on G2.com.,Do not limit resume veiwsReview collected by and hosted on G2.com.,4.0,"['monster', 'helps', 'find', 'qualified', 'candidates', 'diverse', 'set', 'jobs', 'hiring', 'collected', 'hosted', 'many', 'requirements', 'add', 'really', 'help', 'narrow', 'searchreview', 'collected', 'hosted']",0.04305555555555554,0.0,0.08611111111111108
2017-09-25,It allows me to use keywords to find people with certain skillsets.Review collected by and hosted on G2.com.,Using key words to review resumes of candidatesReview collected by and hosted on G2.com.,The candidates that come up are not always current profilesReview collected by and hosted on G2.com.,2.5,"['allows', 'use', 'keywords', 'find', 'people', 'certain', 'collected', 'hosted', 'using', 'key', 'words', 'review', 'resumes', 'candidatesreview', 'collected', 'hosted']",0.10714285714285714,0.21428571428571427,0.0
2017-07-03,"Monster has helped me find qualified candidates for job opportunities in various parts of the country. I have used this website various times while staffing for very niche roles, especially.Review collected by and hosted on G2.com.",The website is very easy to navigate and there are many different ways to sort through the resumes.Review collected by and hosted on G2.com.,Use this site for recruiting purposes.Review collected by and hosted on G2.com.,4.0,"['monster', 'helped', 'find', 'qualified', 'candidates', 'job', 'opportunities', 'various', 'parts', 'country', 'used', 'website', 'various', 'times', 'staffing', 'niche', 'roles', 'collected', 'hosted', 'website', 'easy', 'navigate', 'many', 'different', 'ways', 'sort', 'collected', 'hosted']",0.21055555555555558,0.06666666666666667,0.3544444444444445
2017-06-15,"I'm a Sr. Technical Recruiter; my company uses job boards like Monster and its competitors to source talent, post openings, and research the talent market more broadly.  Monster doesn't completely fall on its face, but it also doesn't have a specialty to compare with the competitors.  CareerBuilder and Indeed have huge (broad and deep) numbers of resumes to search.  IT specific boards like Dice or GitHub have more effective/relevant search results.  LinkedIn offers the greatest amount of information per person.  So on and so forth.  Monster is behind all of these companies in these areas.  Have I found someone to place for an opening on Monster? Yes.  But not nearly as many or as easily as with these other options.Review collected by and hosted on G2.com.",Simple interface made it easy to use most of the time.Review collected by and hosted on G2.com.,Look at other options first. Most others will offer better ROI.Review collected by and hosted on G2.com.,2.5,"['technical', 'recruiter', 'company', 'uses', 'job', 'boards', 'like', 'monster', 'competitors', 'source', 'talent', 'post', 'openings', 'research', 'talent', 'market', 'broadly', 'monster', 'completely', 'fall', 'face', 'also', 'specialty', 'compare', 'competitors', 'careerbuilder', 'indeed', 'huge', 'broad', 'deep', 'numbers', 'resumes', 'search', 'specific', 'boards', 'like', 'dice', 'github', 'search', 'results', 'linkedin', 'offers', 'greatest', 'amount', 'information', 'per', 'person', 'forth', 'monster', 'behind', 'companies', 'areas', 'found', 'someone', 'place', 'opening', 'monster', 'yes', 'nearly', 'many', 'easily', 'collected', 'hosted', 'simple', 'interface', 'made', 'easy', 'use', 'collected', 'hosted']",0.23500000000000001,0.1588888888888889,0.3111111111111111
2017-06-15,Post jobs on Monster to attract great technology candidates across Canada.Review collected by and hosted on G2.com.,Easy to put in place job placements across Canada.Review collected by and hosted on G2.com.,Easy to use but not so good at getting qualified candidates.Review collected by and hosted on G2.com.,3.0,"['post', 'jobs', 'monster', 'attract', 'great', 'technology', 'candidates', 'across', 'collected', 'hosted', 'easy', 'put', 'place', 'job', 'placements', 'across', 'collected', 'hosted']",0.6166666666666667,0.8,0.43333333333333335
